Was the message about the new coronavirus published by UNICEF?,https://teyit.org/en/was-the-message-about-the-new-coronavirus-published-by-unicef/,CLAIM: The informative message about the Covid-19 on social media belongs to UNICEF.,Teyit.False,Sosyal Medya,,FALSE
Did President Trump Say 'People Are Dying Today That Have Never Died Before'?,https://www.snopes.com/fact-check/trump-quote-never-died-before/,"Referring to the ongoing COVID-19 pandemic, U.S. President Donald Trump said, ""People are dying today that have never died before.""",Snopes.False,,,FALSE
Is This Timeline of Trump's Coronavirus Responses Accurate?,https://www.snopes.com/fact-check/timeline-trump-covid19-responses/,A list documents U.S. President Donald Trump's various statements about the spread of COVID-19 coronavirus disease.,Snopes.Mostly True,,,TRUE
Australian News Report Edited To Show Bananas Defend Against COVID-19,https://www.boomlive.in/world/coronavirus/australian-news-report-edited-to-show-bananas-defend-against-covid-19-7266,"According to University of Queensland (Australia) scientists, bananas are an effective defence against the COVID-19.",FALSE,"Social Media users in the Phillipines, Philippine Presidential spokesperson Salvador Panelo",,FALSE
This video has been doctored -- scientists have not found bananas prevent coronavirus infection,https://factcheck.afp.com/video-has-been-doctored-scientists-have-not-found-bananas-prevent-coronavirus-infection,Genuine news report says Australian scientists found bananas prevent COVID-19,FALSE,Multiple sources,,FALSE
"No, Americans aren't getting $700 weekly checks starting March 17 because of coronavirus",https://www.politifact.com/factchecks/2020/mar/18/facebook-posts/no-americans-arent-getting-700-weekly-checks-start/,"“All US citizens are entitled to $700 USD per week to stay at home to avoid the spread of COVID-19 novel coronavirus, starting from March 17.”",FALSE,Facebook posts,,FALSE
Numbers on COVID-19 and H1N1 don't prove current outbreak response is 'hysteria',https://www.politifact.com/factchecks/2020/mar/18/viral-image/numbers-suggesting-h1n1-worse-covid-19-are-mislead/,"“President Trump, COVID-19 coronavirus: U.S. cases 1,329; U.S. deaths, 38; panic level: mass hysteria. President Obama, H1N1 virus: U.S. cases, 60.8 million; U.S. deaths, 12,469; panic level: totally chill. Do you all see how the media can manipulate your life.”",Mostly False,Viral image,,FALSE
Vegan Instagram accounts spread misinformation about COVID-19,https://www.politifact.com/factchecks/2020/mar/18/instagram-posts/vegan-instagram-accounts-spread-misinformation-abo/,"""COVID-19 started because we eat animals.""",Mostly False,Instagram posts,,FALSE
Viral Posts Falsely Align Viruses to Election Years,https://www.factcheck.org/2020/03/viral-posts-falsely-align-viruses-to-election-years/,"COVID-19 is no worse than other outbreaks that have occurred in “every election year.""",FactCheck.False,Facebook posts,,FALSE
Hoax claim circulates online that Israel has no COVID-19 cases after it developed a 'cure',https://factcheck.afp.com/hoax-claim-circulates-online-israel-has-no-covid-19-cases-after-it-developed-cure,"Israel has no confirmed cases of the novel coronavirus, COVID-19",FALSE,Multiple sources,,FALSE
COVID-19 drinking water advice dry on evidence,https://www.aap.com.au/covid-19-drinking-water-advice-dry-on-evidence/,"A Facebook post from March 10, 2020 claims that drinking water regularly will kill COVID-19.",False - The primary claims of the content are factually inaccurate.,A Facebook user,,FALSE
eNCA incorrectly reports that Zimbabwe has a confirmed COVID-19 case,https://zimfact.org/zimbabwe-coronavirus-test/,Zimbabwe reported its first positive COVID-19 test on March 16.,"The claim is false. As of March 17, Zimbabwe still had no confirmed case of coronavirus.",Shahan Ramkissoon,,FALSE
Fake News Site Invents Story About COVID-19 Patient Zero Having ...,https://www.boomlive.in/fake-news/fake-news-site-invents-story-about-covid-19-patient-zero-having-sex-with-bats-7407,Coronavirus patient zero had sex with bats,FALSE,World News Daily Report,,FALSE
Did US 'Refuse' COVID-19 Testing Kits from the World Health Organization?,https://www.snopes.com/fact-check/us-coronavirus-test/,"The United States ""refused"" COVID-19 diagnostic tests offered by the World Health Organization.",Snopes.Mixture,,,FALSE
Is Amazon Suspending All Deliveries Except Medical Supplies?,https://www.snopes.com/fact-check/amazon-suspending-deliveries-covid/,Amazon announced that it was suspending all deliveries except for medical supplies during the COVID-19 pandemic.,Snopes.Mostly False,,,FALSE
"No, Korean drama 'My Secret, Terrius' did not 'predict' COVID-19",https://www.altnews.in/no-korean-drama-my-secret-terrius-did-not-predict-covid-19/,"Korean drama 'My Secret, Terrius' predicted coronavirus outbreak",FALSE,Social media and mainstream media,,FALSE
Fact Check: Don't believe this home remedy to cure Covid-19,https://www.indiatoday.in/fact-check/story/do-not-believe-this-home-remedy-cure-covid-19-1660728-2020-03-28,Inhaling the steam of sea salt and orange peelings can prevent coronavirus infection.,Mostly false,Linwood Waller and other Facebook users,,FALSE
Video Of Mock Drill On COVID-19 Preparedness In Punjab Viral As Real,https://www.boomlive.in/fake-news/video-of-mock-drill-on-covid-19-preparedness-in-punjab-viral-as-real-7254,Video shows policemen arrested patients of COVID-19 in Punjab,FALSE,Social media,,FALSE
Are These Vegan Foods Left Unsold During the COVID-19 Pandemic?,https://www.snopes.com/fact-check/vegan-food-unsold/,A photograph shows store shelves stripped of all foodstuffs except for vegan products during the COVID-19 pandemic.,Snopes.Miscaptioned,Multiple Sources,,FALSE
